{
  "$schema": "https://json-schema.org/draft/2020-12/schema",
  "$id": "https://cdn.jsdelivr.net/gh/StartHalo/sl8-templates@main/templates.schema.json",
  "title": "StartHalo sl8-* E2B templates registry",
  "description": "Public, machine-readable inventory of the sl8-* family of E2B sandbox templates and their tool packs. Generated from StartHalo/sl8-tools and mirrored to StartHalo/sl8-templates. See docs/features/e2b-templates-registry/ in sl8-tools for full documentation.",
  "type": "object",
  "additionalProperties": true,
  "required": [
    "schemaVersion",
    "generatedAt",
    "sourceCommit",
    "templates",
    "archivedTemplates"
  ],
  "properties": {
    "schemaVersion": {
      "type": "integer",
      "const": 1,
      "description": "Major schema version. Incompatible changes bump this; consumers MAY refuse to parse files whose version they don't understand."
    },
    "generatedAt": {
      "type": "string",
      "format": "date-time",
      "description": "ISO-8601 UTC timestamp of when this snapshot was generated."
    },
    "sourceCommit": {
      "type": "string",
      "pattern": "^([0-9a-f]{40}|uncommitted)$",
      "description": "Full 40-char git SHA of the sl8-tools commit this snapshot was generated from, or the literal 'uncommitted' for ad-hoc local runs."
    },
    "templates": {
      "type": "array",
      "description": "Every active sl8-* template, sorted with sl8-base first then alphabetically.",
      "items": { "$ref": "#/$defs/TemplateEntry" }
    },
    "archivedTemplates": {
      "type": "array",
      "description": "Templates that used to exist and have been replaced.",
      "items": { "$ref": "#/$defs/ArchivedEntry" }
    }
  },
  "$defs": {
    "TemplateEntry": {
      "type": "object",
      "description": "An active sl8-* template. Either has `components` (base templates) or `base` + `packs` (variant templates).",
      "additionalProperties": true,
      "required": ["name", "status", "currentVersion", "aliases"],
      "properties": {
        "name": {
          "type": "string",
          "pattern": "^sl8-[a-z0-9-]+$",
          "description": "Template name. Matches the directory under e2b/ in sl8-tools AND the generic alias."
        },
        "status": {
          "type": "string",
          "enum": ["active"],
          "description": "Always 'active' for anything in `templates`; archived templates live in archivedTemplates. DO NOT widen this enum to express deprecation — consumers hard-filter on `status === 'active'` (@starthalo/bot-cli runtimes-registry), so a template still in service but closed to new work would vanish from every runtime list and fail `bot validate`. Deprecation is carried additively by `lifecycle`."
        },
        "lifecycle": {
          "type": "string",
          "enum": ["active", "deprecated"],
          "default": "active",
          "description": "Whether this template is open to NEW work. 'deprecated' means still published, still resolvable, existing bots keep running — but nothing new should pin it. Absent means 'active', so entries written before this field remain valid. Orthogonal to `status`, which stays 'active' for the whole service life."
        },
        "deprecation": {
          "type": "object",
          "description": "Required iff lifecycle is 'deprecated'. Records why, and what still stands in the way of archiving.",
          "additionalProperties": false,
          "required": ["since", "reason", "successor", "blockers"],
          "properties": {
            "since": {
              "type": "string",
              "pattern": "^\\d{4}-\\d{2}-\\d{2}$",
              "description": "Date the template was closed to new work."
            },
            "reason": {
              "type": "string",
              "minLength": 1,
              "description": "One line: why it is being retired."
            },
            "successor": {
              "type": ["string", "null"],
              "description": "The template new work should use instead, or null when none exists yet. Null is the honest value — never point at a template that cannot host the workloads."
            },
            "blockers": {
              "type": "array",
              "items": { "type": "string" },
              "description": "Consumers that must be migrated or retired before this template can be archived. GENERATED, not hand-authored — recomputed from every bot.yaml sandboxTemplate pin plus the studio registry, so it cannot go stale."
            }
          }
        },
        "currentVersion": {
          "type": "string",
          "pattern": "^v[0-9]{8}-[0-9]{6}$",
          "description": "Timestamped version (vYYYYMMDD-HHMMSS) currently promoted for this template."
        },
        "aliases": {
          "type": "object",
          "required": ["versioned", "generic"],
          "additionalProperties": false,
          "properties": {
            "versioned": {
              "type": "string",
              "description": "Pinned alias — '<name>-<currentVersion>'. Use for reproducible jobs. Never auto-updates."
            },
            "generic": {
              "type": "string",
              "description": "Floating alias equal to `name`. Resolves to whatever is currently promoted. Auto-updates on every promotion."
            }
          }
        },
        "components": {
          "type": "array",
          "description": "Installed tools/runtimes on a base template (e.g. sl8-base). Mutually exclusive with `packs`.",
          "items": {
            "type": "object",
            "required": ["name", "version"],
            "additionalProperties": false,
            "properties": {
              "name": {
                "type": "string",
                "description": "Canonical package name (e.g. '@anthropic-ai/claude-code') or runtime label ('Node.js', 'gcsfuse')."
              },
              "version": {
                "type": "string",
                "description": "Version pinned at template build time. May be a full semver, a major-only marker ('20.x'), or 'system' for OS-provided components."
              }
            }
          }
        },
        "base": {
          "type": "object",
          "description": "The base template this variant inherits from. Present on variants; absent on base templates.",
          "required": ["template", "version"],
          "additionalProperties": false,
          "properties": {
            "template": {
              "type": "string",
              "description": "Base template name (e.g. 'sl8-base')."
            },
            "version": {
              "type": "string",
              "pattern": "^v[0-9]{8}-[0-9]{6}$",
              "description": "Exact base version this variant's template.ts pins via fromTemplate(...)."
            }
          }
        },
        "packs": {
          "type": "array",
          "description": "Tool packs layered on top of the base, in install order. Mutually exclusive with `components`.",
          "items": { "$ref": "#/$defs/PackEntry" }
        },
        "ui": {
          "$ref": "#/$defs/Ui",
          "description": "Curated display copy and brand (name, emoji, tagline, capability chips, accent, per-package blurbs). Under the Studio Registry Contract (REGISTRY-CONTRACT.md) every active template MUST ship either a contract-complete ui block or `ui.hidden: true` — the generator enforces this. Consumers fail closed: a non-compliant template is hidden from discovery and renders a neutral fallback for stored ids."
        }
      },
      "oneOf": [
        { "required": ["components"], "not": { "required": ["base"] } },
        { "required": ["base", "packs"], "not": { "required": ["components"] } }
      ]
    },
    "Ui": {
      "type": "object",
      "description": "Curated display copy and brand for a runtime — the Studio's consumer identity per REGISTRY-CONTRACT.md. Authored in e2b/<template>/ui.json and embedded verbatim by the registry generator, which enforces the contract (R2–R8) on every non-hidden block.",
      "additionalProperties": false,
      "properties": {
        "displayName": {
          "type": "string",
          "minLength": 1,
          "maxLength": 60,
          "description": "The Studio's name (R2): Title Case, 1–3 words, unique case-insensitively across consumer-ready templates, consumer-grade. Never include the word 'Studio' — the app derives '{displayName} Studio' from it."
        },
        "emoji": {
          "type": "string",
          "minLength": 1,
          "maxLength": 8,
          "description": "Exactly one emoji grapheme (R5), used on compact chips and admin surfaces (e.g. '🎬'). Avoid flags or politically-loaded symbols."
        },
        "tagline": {
          "type": "string",
          "minLength": 1,
          "maxLength": 200,
          "description": "One sentence, sentence case, ends with a period (R3) — why you'd work here, written for a non-technical customer. Renders verbatim on the picker card and product page subtitle."
        },
        "description": {
          "type": "string",
          "maxLength": 2000,
          "description": "Multi-sentence body text for info popovers / detail pages. Two to four sentences: what it is, what's notable, when to pick it."
        },
        "capabilities": {
          "type": "array",
          "maxItems": 6,
          "items": {
            "type": "string",
            "maxLength": 40
          },
          "description": "Up to 6 short consumer-grade chips (R6) — 'Cutting & encoding', not package names. The app additionally filters chips through its lexicon at render time; an off-brand chip is dropped, not shown."
        },
        "brand": {
          "$ref": "#/$defs/Brand",
          "description": "The Studio's visual brand (R4). Required (with a complete accent) on every consumer-ready template."
        },
        "hidden": {
          "type": "boolean",
          "description": "true = deliberately not consumer-facing (R7): infrastructure image, base layer, or not-yet-launched product. Skipped by all consumer surfaces without being logged as a violation, and exempt from the other ui contract requirements."
        },
        "packageOverrides": {
          "type": "object",
          "description": "Per-component or per-pack friendly text, keyed by component.name (base templates) or pack.id (variant templates). Unknown keys are an authoring error.",
          "additionalProperties": {
            "type": "object",
            "additionalProperties": false,
            "properties": {
              "name": {
                "type": "string",
                "maxLength": 60,
                "description": "Override of the technical name for display."
              },
              "blurb": {
                "type": "string",
                "maxLength": 200,
                "description": "One friendly sentence aimed at a non-technical user. Skip the version — it's shown separately."
              },
              "technical": {
                "type": "string",
                "maxLength": 500,
                "description": "Appendix-grade text for a 'show details' panel. Include version, key flags, operational caveats."
              }
            }
          }
        }
      }
    },
    "Brand": {
      "type": "object",
      "description": "A Studio's visual brand (REGISTRY-CONTRACT.md R4). The accent must be complete — a partial accent is invalid; no half-brands.",
      "additionalProperties": false,
      "properties": {
        "logoSrc": {
          "type": "string",
          "description": "Reserved; unconsumed by SL8 today. The mark is the ∞ glyph tinted by accent.solid."
        },
        "accent": {
          "type": "object",
          "additionalProperties": false,
          "required": ["from", "to", "solid"],
          "properties": {
            "from": {
              "type": "string",
              "pattern": "^#[0-9a-fA-F]{6}$",
              "description": "Gradient start."
            },
            "to": {
              "type": "string",
              "pattern": "^#[0-9a-fA-F]{6}$",
              "description": "Gradient end."
            },
            "solid": {
              "type": "string",
              "pattern": "^#[0-9a-fA-F]{6}$",
              "description": "Single solid accent — rings, tints, focus. Should be distinct from other Studios' solids and legible on light and dark grounds."
            }
          }
        }
      }
    },
    "PackEntry": {
      "type": "object",
      "description": "A tool pack layered onto a variant template.",
      "required": ["id", "version", "description", "provides", "agentGuidance"],
      "additionalProperties": false,
      "properties": {
        "id": {
          "type": "string",
          "pattern": "^[a-z][a-z0-9-]*$",
          "description": "Stable ID (matches the pack directory under e2b/tool-packs/)."
        },
        "version": {
          "type": "string",
          "pattern": "^[0-9]+\\.[0-9]+\\.[0-9]+(-[0-9A-Za-z.-]+)?(\\+[0-9A-Za-z.-]+)?$",
          "description": "Semver. Bumped when install behaviour or agentGuidance changes."
        },
        "description": {
          "type": "string",
          "description": "One-line human description."
        },
        "provides": {
          "type": "array",
          "description": "CLIs / capabilities this pack exposes (e.g. ['ffmpeg', 'ffprobe']).",
          "items": { "type": "string" }
        },
        "agentGuidance": {
          "type": "string",
          "description": "Concrete usage instructions for skills/agents using this pack's tooling. Also baked into /etc/sl8/capabilities.json inside the sandbox."
        }
      }
    },
    "ArchivedEntry": {
      "type": "object",
      "required": ["name", "lastVersion", "replacedBy"],
      "additionalProperties": false,
      "properties": {
        "name": {
          "type": "string",
          "description": "Template that used to exist."
        },
        "lastVersion": {
          "type": "string",
          "description": "Last version published before archival."
        },
        "replacedBy": {
          "type": "string",
          "description": "Current template consumers should use instead."
        }
      }
    }
  }
}
