{
  "schemaVersion": 1,
  "generatedAt": "2026-10-18T01:47:22Z",
  "sourceCommit": "3809e94dcf46af6ec994ed9d7520282aedc36f3a",
  "templates": [
    {
      "name": "sl8-base",
      "status": "active",
      "currentVersion": "v20261010-184536",
      "aliases": {
        "versioned": "sl8-base:v20261010-184536",
        "generic": "sl8-base"
      },
      "components": [
        {
          "name": "Node.js",
          "version": "22.x"
        },
        {
          "name": "@starthalo/skills-shared",
          "version": "0.2.0"
        },
        {
          "name": "@starthalo/skills-cli",
          "version": "1.3.1"
        },
        {
          "name": "@starthalo/ai-gen",
          "version": "2.2.0"
        },
        {
          "name": "@starthalo/sl8-agent",
          "version": "0.3.0"
        },
        {
          "name": "@anthropic-ai/claude-code",
          "version": "2.1.285"
        },
        {
          "name": "pnpm",
          "version": "11.5.2"
        },
        {
          "name": "yarn",
          "version": "1.22.22"
        },
        {
          "name": "typescript",
          "version": "7.0.2"
        },
        {
          "name": "gcsfuse",
          "version": "system"
        }
      ],
      "ui": {
        "displayName": "General",
        "emoji": "🤖",
        "tagline": "The all-round Studio — image and video models, content tools, and code.",
        "description": "The general-purpose workspace most bots should use. Includes Claude Code, AI Gen, the Skills CLI, a TypeScript toolchain, and all three Node package managers. Pick this when you don't need anything beyond standard web/Node/AI tooling.",
        "capabilities": [
          "Image & video models",
          "Writing & content",
          "Code & data work",
          "Custom skills",
          "File delivery"
        ],
        "brand": {
          "accent": {
            "from": "#E04010",
            "to": "#F39A24",
            "solid": "#E8631A"
          }
        },
        "packageOverrides": {
          "@anthropic-ai/claude-code": {
            "blurb": "Anthropic's coding assistant runs right inside the workspace."
          }
        }
      }
    },
    {
      "name": "sl8-animation",
      "status": "active",
      "currentVersion": "v20260711-182132",
      "aliases": {
        "versioned": "sl8-animation-v20260711-182132",
        "generic": "sl8-animation"
      },
      "base": {
        "template": "sl8-base",
        "version": "v20260711-011211"
      },
      "packs": [
        {
          "id": "python-runtime",
          "version": "1.0.0",
          "description": "Python 3 + pip + venv + build tooling for native extensions.",
          "provides": [
            "python3",
            "pip3",
            "venv"
          ],
          "agentGuidance": "Python 3 is at `python3` (no unversioned `python`). Use `pip3 install --break-system-packages <pkg>` for system-wide installs (this image follows PEP 668), or `python3 -m venv .venv && source .venv/bin/activate` for a project-local venv. Native-extension build tools (build-essential, pkg-config, python3-dev) are present, so packages like Pillow, lxml, manim can compile from source if needed."
        },
        {
          "id": "ffmpeg",
          "version": "1.0.0",
          "description": "FFmpeg for video/audio encoding and frame-to-MP4 assembly.",
          "provides": [
            "ffmpeg",
            "ffprobe"
          ],
          "agentGuidance": "Use `ffmpeg -i <input> <output>` for transcoding, `ffmpeg -framerate <fps> -i frame_%04d.png out.mp4` for frame sequences, and `ffprobe -v quiet -print_format json -show_format -show_streams <file>` to inspect media. The Debian ffmpeg build includes the common codecs (libx264, libvpx, aac); use `-c:v libx264 -pix_fmt yuv420p` for broadly-compatible MP4 output."
        },
        {
          "id": "latex",
          "version": "1.0.0",
          "description": "TeX Live (LaTeX) + dvisvgm — needed for MathTex / Tex rendering in animation pipelines and for PDF/SVG math output.",
          "provides": [
            "latex",
            "pdflatex",
            "dvisvgm",
            "tex"
          ],
          "agentGuidance": "Compile LaTeX with `pdflatex <file.tex>` or `latex <file.tex>`. The texlive-latex-extra, texlive-fonts-extra, texlive-latex-recommended, texlive-science and tipa packages are included — covering Manim's `MathTex`/`Tex` requirements and most paper-style documents. Use `dvisvgm <file.dvi>` to convert DVI to SVG. First invocation is slow (font cache build); subsequent calls are fast."
        },
        {
          "id": "xvfb",
          "version": "1.0.0",
          "description": "Xvfb virtual framebuffer + Mesa OpenGL libs — lets headless OpenGL workloads (ManimGL, Blender headless, etc.) render without a real display.",
          "provides": [
            "xvfb-run",
            "Xvfb"
          ],
          "agentGuidance": "Wrap OpenGL/GUI commands with `xvfb-run -a <command>` to give them a virtual display (`-a` auto-picks a free server number). For longer pipelines export a persistent display: `Xvfb :99 -screen 0 1920x1080x24 & export DISPLAY=:99`. Required for ManimGL (`manimgl`); not required for Manim CE (`manim`) which renders headlessly via Cairo."
        },
        {
          "id": "manim",
          "version": "1.0.0",
          "description": "Manim Community Edition (manim) + ManimGL (manimlib) — the two leading Python animation engines, with their native Cairo/Pango deps.",
          "provides": [
            "manim",
            "manimgl"
          ],
          "agentGuidance": "Two engines coexist. Manim CE — `manim -ql <file.py> <SceneClass>` (Cairo-based, headless, default for most agents). ManimGL — `xvfb-run -a manimgl <file.py> <SceneClass>` (OpenGL; the import itself opens a display, so any `manimgl` invocation or even `import manimlib` must be wrapped in `xvfb-run -a` or run with `DISPLAY` set — the xvfb pack provides this). Python import names differ: `import manim` vs `import manimlib`. Renders land in `./media/videos/<file>/<quality>/<SceneClass>.mp4` by default; pass `--media_dir /home/user/artifacts` to redirect into the artifacts mount. Use `-ql` (480p), `-qm` (720p), `-qh` (1080p) to trade speed for quality."
        },
        {
          "id": "chrome-headless",
          "version": "1.0.0",
          "description": "Shared system libraries required to run a headless Chrome / Chrome Headless Shell on Debian Bookworm. Installs no browser binary — downstream packs (e.g. remotion) fetch their own Chrome.",
          "provides": [
            "chrome-headless-libs"
          ],
          "agentGuidance": "Provides the native shared libraries a headless Chromium needs (NSS, GBM/Mesa, ALSA, ATK + ATK-bridge, Cairo/Pango, X composite/damage/fixes/randr, CUPS, dbus). It installs NO browser binary — tools that drive headless Chrome (Remotion, Puppeteer, Playwright) must download or point at their own Chromium build; this pack only guarantees the OS-level .so dependencies resolve. If a render fails with `error while loading shared libraries: libXXX.so: cannot open shared object file`, the missing library belongs here."
        },
        {
          "id": "remotion",
          "version": "1.0.0",
          "description": "Remotion CLI (React/HTML → MP4 video rendering) with a Chrome Headless Shell pre-downloaded at build time and exposed at a fixed, world-readable path so the non-root runtime user can render offline.",
          "provides": [
            "remotion"
          ],
          "agentGuidance": "Remotion renders React compositions to MP4 via headless Chrome. The CLI is installed globally (`remotion`). A Chrome Headless Shell is pre-downloaded to the fixed, world-readable path /opt/remotion/chrome-headless-shell (also exported as $CHROME_HEADLESS_SHELL in interactive shells), so renders work offline without the ~150MB first-run download. Remotion has NO env var for the browser path, so you MUST pass it explicitly with the literal path (env vars are not present in non-interactive `commands.run`): `remotion render <entry> <CompositionId> /home/user/artifacts/out.mp4 --browser-executable /opt/remotion/chrome-headless-shell`. Typical flow: scaffold or open a Remotion project (`package.json` with `remotion` + `src/index.ts` calling registerRoot, and a Root that registers <Composition> ids), `npm install`, then render with the flag above. Without `--browser-executable`, Remotion re-downloads Chrome into the project's node_modules/.remotion. System ffmpeg is present (the ffmpeg pack); Remotion also bundles its own. Domain knowledge lives in the `remotion-best-practices` skill (`skills add remotion-best-practices`) — 38 rule files on captions, audio, sequencing, transitions, fonts, etc."
        },
        {
          "id": "hyperframes",
          "version": "1.4.0",
          "description": "HeyGen HyperFrames CLI (HTML/CSS/GSAP -> deterministic MP4 via headless Chrome + ffmpeg). Requires Node 22+. Ships 0.8.61 — 53 releases on from the 0.8.8 this pack carried since 2026-08-22. `check` remains the unified verification gate (lint + headless-browser runtime/layout/motion/contrast audit in one pass). A PINNED Chrome is pre-installed and its path frozen at /etc/sl8/chrome-path (+ /opt/chrome/chrome symlink) so renders run offline with no per-run download. THE INSTALL IS CHOWNED TO `user` (1.4.0): the CLI repairs itself at runtime, and against a root-owned tree that repair half-completes and deletes the CLI — measured, see pack.ts. Local-only/keyless render core: voiceover/captions/background-removal come from AI Gen; HeyGen cloud features and @hyperframes/aws-lambda are excluded.",
          "provides": [
            "hyperframes"
          ],